ID,text,patchSetNum,changeId,orderTime,createTime,commitTime,timeDiff,reviewStatus,fileNum,churn,authorNum,comments,patchsetCounts,Overall,Positive,Negative
1219,Patch Set 2:Hi Matthias. Have you intentionally waited until Nov 29 before you uploaded this pathset? Look at the history of this change .... exactly 3 years dormant until beeing rebased and accepted. :-),2,8283,2014/12/1 15:39,2011/11/29 16:35,2014/11/29 1:16,26288,MERGED,2,33,3,6,2,positive,2,-1
1225,"Patch Set 4:> The patch includes the following changesIMHO it is very good that you explain your modifications here, but it may also be worth to edit the commit message, e.g.- remove ""(Requires that the host and all fragments have the same qualifier.)""- add a comment on the buildSWT.xml changes, e.g. ""Modified buildSWT.xml to generate the time stamp qualifiers and write the qualifiers in the pom files in source and binaries repos.""",4,8319,2014/11/19 10:21,2011/12/17 14:30,2014/11/19 9:36,25627,MERGED,4,125,3,7,6,positive,3,-1
1227,Patch Set 2: Verified+1 Code-Review+2We finished this contribution by pair programming. Verified with manual test cases in an Eclipse 4 test application. Everything looks fine. Thanks for the help!,2,8359,2014/11/18 18:08,2014/11/18 18:03,2014/11/18 18:03,0,MERGED,8,1101,1,3,2,positive,3,-1
1229,"Patch Set 1:Code change looks fine, but the complete reformatting of the file should be avoided. Can you update the patch Tom to remove the format change?",1,8371,2014/10/30 4:30,2014/10/29 7:31,2014/10/29 7:31,0,MERGED,1,232,4,5,3,positive,3,-2
1230,"Patch Set 2: Code-Review-1(7 comments)From a technical point of view, I don't see any issues and think the solution is fine! I only added some more minor style suggestions (sorry for not checking them earlier).Thanks!",2,8373,2014/11/7 16:13,2014/11/3 10:02,2014/11/3 14:44,4,MERGED,6,200,3,4,8,positive,4,-2
1233,"Patch Set 1:(1 comment)CQ seems to be not needed, and the rest I will do next week. Thanks!",1,8377,2014/11/8 6:57,2014/11/7 15:30,2014/11/7 15:30,0,MERGED,6,229,4,8,3,positive,3,-1
1234,Patch Set 1: Verified+1 Code-Review-1The reference to base images such as the info bulb has been in-lined into the style template as a base64 encoded string.This will lead to a lot of duplicate data in the generated HTML output: ((HTML file count - 1) * size of images) instead of the approach that is currently used.I'd like to see a solution referencing those pictures instead of in-lining them.,1,8386,2014/11/14 12:10,2014/11/14 11:41,2014/11/14 11:52,0,MERGED,465,50664,2,2,3,positive,2,-1
1236,"Patch Set 1:Remi & Camille, please take a look at the change https://git.eclipse.org/r/#/c/34447/1/plugins/uml/diagram/org.eclipse.papyrus.uml.diagram.clazz/custom-src/org/eclipse/papyrus/uml/diagram/clazz/custom/edit/commands/RestoreRelatedLinksCommand.javaIt should help with the very first invocations of the UmlViewProvider where ""null"" is filtered by xml declaration. In just a normal GMF-T this would be safe change, but you may know better whether the old null hint here was intentional.",1,8403,2014/10/6 13:55,2014/10/6 10:38,2014/10/6 11:18,0,MERGED,2,86,4,6,2,positive,2,-1
1240,"Patch Set 1:About cleaning (//$NON-NLS-1) I don't think that there is any  official Papyrus recommendation for this sort of improvement. (continuously vs standalone commit)About FilteringPaletteProvider, it should work on any IPaletteprovider. For example it should also work recursively and on ExtendedpluginPaletteProvider (new recommended way of palette customization)=> Is there any know use case where this doesn't work ? About WalkerPaletteContributionHelper  : I think there will be another feature for this. We are reading the file for each palette, although it could be read only the first time.",1,8410,2014/11/4 8:39,2014/11/3 13:48,2014/11/3 13:48,0,MERGED,3,92,3,6,3,positive,2,-1
1242,"Patch Set 1: Code-Review-1(1 comment)Thank you for this snippet. I would like to change a little bit, though.If you want to change your snippet, just reclick ""Share Snippet(s)"" but make sure to include the Change-Id from this change in the commit message.",1,8424,2014/11/3 15:45,2014/11/3 14:22,2014/11/3 14:22,0,MERGED,2,18,2,2,4,positive,2,-1
1245,"Patch Set 1: Verified-1 Code-Review-1Redoing a new element creation that was undone does not select-reveal the (re)created element.I understand that we can't just do as an EMF-generated editor does and attach a command-stack listener that selects the affected objects of whatever was the last command executed/undone/redone, because it could have been a command in the diagram or other context that should not alter the Model Explorer selection.   So, the idea of the command wrapper is neat.However, the command-wrapper would be more reusable/safe if it didn't explicitly look for the Model Explorer view (maybe there are multiple instances of it!) but instead checked that the currently active view provides the IRevealSemanticElement protocol.  Also, it should account for selecting the object(s) affected by undo and redo.  In the case of redo, that's the same as execute, but in the case of undo, the affected object should be the one that the new object had been created in.Also, why select-reveal only the first result?  If multiple objects were created, I would expect all of them to be selected.  At least, this is how EMF-generated editors work.",1,8433,2014/11/3 21:18,2014/10/30 10:50,2014/10/30 10:50,0,MERGED,3,184,3,4,3,positive,2,-1
1247,"Patch Set 2: Code-Review+2 Verified+1Thanks Simon, looks good. I think we should ""modernize"" the ""new"" dialog a bit (use List/Collections, Varargs) as input and output but this fixes the warning reported by Dani.",2,8464,2014/11/4 22:42,2014/11/4 9:35,2014/11/4 22:41,13,MERGED,2,18,2,5,2,positive,2,-1
1250,Patch Set 3:(2 comments)Thank you. Verified works. Can you please update as well the copyright years,3,8489,2014/11/3 9:15,2014/10/6 7:20,2014/10/29 14:06,558,MERGED,7,62,3,8,6,positive,2,-1
1251,"Patch Set 2:Chris, any estimate on when you'll have some time to look over the change ? It would be nice to get this in to make 'fragment' creation easy for packagers.",2,8505,2014/10/20 19:47,2013/12/13 15:47,2013/12/17 15:42,95,MERGED,3,144,3,6,3,positive,2,-1
1252,"Patch Set 3: Code-Review-2I tested it in different situation (auto save without editors, save) but I also tried some control (ecore model, with several sub package and diagrams) and it does nothing.",3,8522,2014/10/21 14:46,2014/10/21 12:22,2014/10/21 13:34,1,MERGED,2,52,3,7,4,positive,2,-1
1257,"Patch Set 1: Code-Review-1(1 comment)Thanks Dirk, See inline comment for a suggestion how to group the context handling for localization.",1,8568,2014/10/20 20:18,2014/10/20 19:52,2014/10/20 19:52,0,MERGED,1,9,3,4,4,positive,2,-1
1258,"Patch Set 1: Code-Review-1(2 comments)This looks fine to me, with just a few changes to be made :- Extraneous whitespace in every file- Old Code that can probably be removed rather than uncommented- toArray usage",1,8573,2014/10/20 18:31,2014/10/20 18:12,2014/10/20 18:12,0,MERGED,5,101,3,5,3,positive,3,-1
1259,"Patch Set 2: Verified+1 Code-Review+2This looks fine to me. Just waiting for the result of the hudson test run, and we can push to master.",2,8573,2014/10/20 19:01,2014/10/20 18:12,2014/10/20 18:51,0,MERGED,5,202,3,5,3,positive,3,-1
1264,"Patch Set 3: Code-Review+1The changes looked good, but there were still cases where the NULL_CONFIG could be leaked for required properties. Fixed those cases and added regression tests.",3,8586,2014/10/17 18:29,2014/10/15 17:25,2014/10/17 18:26,49,MERGED,2,215,2,4,4,positive,2,-1
1266,"Patch Set 7: Verified+1 Code-Review+2Looks good! The new tests pass, and smoke testing found no regressions against the non-JNI style traces.",7,8588,2014/10/8 17:08,2014/8/27 13:02,2014/9/10 14:42,337,MERGED,4,177,3,4,8,positive,3,-1
1269,"Patch Set 29: Code-Review+1Thanks Frank, this looks good. Steffen, do you want to have a look?",29,8634,2014/10/3 20:14,2014/6/2 19:40,2014/10/3 19:22,2951,MERGED,16,264,5,8,30,positive,2,-1
1273,Patch Set 20:If we can change the extension point reader to inject the core connector that seems like a good idea but I'm not sure we want to invest in creating that logic (rather than use something like guice). It seems to me that you need to deal with connector UIs having a null connector anyways in that case due to backwards compatibility so an initialize/setConnector() method seems more reasonable.,20,8634,2014/7/17 19:35,2014/6/2 19:40,2014/7/8 18:12,862,MERGED,15,188,4,7,30,positive,2,-1
1275,"Patch Set 1: Code-Review-1I'm fine with the page in itself, but I don't like the ""smell"" of a commercial product page in an open source demo. Tim's suggestion was to use http://xkcd.com, I like it!",1,8642,2014/10/8 14:11,2014/10/7 11:23,2014/10/7 11:24,0,MERGED,1,10,4,5,2,positive,3,-2
1276,"Patch Set 2:(In reply to comment #5)> Patch Set 1: Code-Review-1> Tim's suggestion was to use http://xkcd.com, I like it!Done!",2,8642,2014/10/8 14:22,2014/10/7 11:23,2014/10/8 14:22,26,MERGED,1,10,3,6,2,positive,3,-1
1277,"Patch Set 2: Code-Review-1(2 comments)Looks good, but as mentioned in the comments this will probably break the API. Should wait for 4.0/TraceCompass.",2,8649,2014/9/17 21:25,2014/9/9 16:50,2014/9/9 17:18,0,MERGED,2,53,3,6,5,positive,2,-1
1279,"Patch Set 1: Code-Review-1(1 comment)Thanks, but for the removal of Non-Javadoc statements we do not add the names to the copyright. The change it to minor.",1,8677,2014/10/6 23:21,2014/10/6 23:11,2014/10/6 23:11,0,MERGED,3,109,3,4,3,positive,2,-1
1280,"Patch Set 1:Hi Sergey, thanks for your comments.I can confirm that the ""org.hamcrest.core"" bundle has shipped with every release of Eclipse since at lease 3.8.",1,8680,2014/10/7 20:51,2014/10/7 11:46,2014/10/7 12:20,0,MERGED,7,14,3,7,2,positive,2,-1
1284,"Patch Set 2: Code-Review+2 Verified+1Thanks Dirk. I also activated to remove whitespace, I hope that is OK for tests.",2,8725,2014/9/26 11:16,2014/9/24 14:36,2014/9/26 11:15,44,MERGED,2,346,1,3,2,positive,3,-1
1286,"Patch Set 1: Code-Review+1(2 comments)It looks pretty good !I have added a couple of minor inline comments, I have also done some manual test and works fine !Note. This class is perfect for Junit, it populates the collection with interface types which can be easily mocked outside of the actual implementation.",1,8750,2014/9/23 2:13,2014/9/22 20:43,2014/9/22 20:44,0,MERGED,1,43,4,5,3,positive,5,-3
1291,"Patch Set 5: Code-Review+1This now places sources in target/generated-sources/xcore (where they are subject to ""mvn clean"" and .gitignore).Tested that the o.e.r.stacktraces.rcp.feature installs fine into Luna and Kepler SR2 Standard packages.Juno, however, by default lacks an update site that has org.eclipse.emf.ecore.xcore.lib 0.0.0. I don't see this as a blocker for this change, however.",5,8810,2014/9/11 12:20,2014/9/10 12:07,2014/9/11 11:14,23,MERGED,42,8928,2,5,9,positive,3,-2
1295,"Patch Set 3: Code-Review+1(2 comments)Other than the two missing distribution statements, it looks fine.",3,8823,2014/9/2 23:34,2014/8/26 18:51,2014/8/29 23:10,76,MERGED,43,1058,3,8,14,positive,3,-1
1300,"Patch Set 3:Ehh, this wasn't my best tested patch. Dawid, thanks for help. Hopefully right now it should work well.",3,8844,2014/9/9 19:57,2014/9/7 21:15,2014/9/9 19:32,46,MERGED,1,184,3,7,5,positive,2,-1
1305,"Patch Set 1:Hi Neal,you messed things up a bit.1. On updating a patch you need to amend you changes so they have the same change id and we can see it in Gerrit in a clean timeline. You have created a new patch, which is not that good.2. You created a new example, which is also good. :) But I asked for tests. We have several JUnit test cases in the org.eclipse.nebula.widgets.nattable.core.test project. Adding the test cases will help us to verify that everything is working as expected and if anybody changes code later, it still works.3. I can see the whitespace issues in the Gerrit web view. Just open your changes there and you will see them marked red.I haven't pushed the modified code as I'm waiting for your modifications. :) And Gerrit will nofify you when I've done it.Greez,DirkP.S. I just noticed that you forgot to add yourself to the copyright header of the AutomaticSpanningDataProvider.",1,8870,2014/9/2 6:46,2014/8/28 6:17,2014/8/28 9:23,3,MERGED,1,59,2,5,3,positive,2,-1
1306,"Patch Set 1: Code-Review+1I am agree, this message is much clearer than original that sounded like Florian :p",1,8873,2014/9/10 1:15,2014/9/9 22:32,2014/9/9 22:35,0,MERGED,1,6,3,5,2,positive,2,-1
1310,Patch Set 1:(2 comments)Thanks Lars. I just implemented your proposals in the comments.,1,8907,2014/8/28 11:33,2014/8/28 0:27,2014/8/28 0:54,0,MERGED,9,745,3,5,6,positive,2,-1
1311,Patch Set 1:Looks good. Most committer will advice you to avoid unnecessary dependencies in your Gerrit reviews. Maybe as practice you use interactive rebase for this review to remove the dependencies on the clean JFace commit?,1,8909,2014/8/29 10:00,2014/8/28 21:41,2014/8/28 21:41,0,MERGED,4,12,3,5,4,positive,2,-1
1312,"Patch Set 2:I am happy with the existing comparator. I just couldn't find it.When comparing a small number of strings such as when sorting tags, the effiency of the existing implementation is probably sufficient.",2,8935,2014/8/28 7:37,2014/8/21 9:37,2014/8/28 7:32,165,MERGED,1,6,3,6,2,positive,2,-1
1315,Patch Set 1:Hi Michael - could you please rebase your patch and resubmit? There are some merge conflicts. Thanks!,1,8947,2014/8/28 20:29,2014/8/20 9:10,2014/8/20 11:15,2,MERGED,8,567,2,2,2,positive,3,-1
1316,Patch Set 2: Verified+1 Code-Review+2Thanks for the patch(es) - they were both very useful!,2,8947,2014/8/29 18:52,2014/8/20 9:10,2014/8/29 7:09,213,MERGED,8,479,2,4,2,positive,4,-1
1317,"Patch Set 14:(3 comments)Hi,The problem with the save as action was that the data binding contexts were not update when the editor input was changed.Because of this, after a save-as action, when a change was made to one of the fields (e.g. the name in the metadata page), the corresponding page was marked as stale instead of dirty, as the databindings were still observing the old snippet.I hope this makes sense. Anyway, I added listeners in each page that will take care of updating the db contexts and the snippet when the editor input changes.",14,8960,2014/8/27 14:40,2014/6/12 19:10,2014/8/27 12:19,1817,MERGED,21,871,3,7,18,positive,3,-2
1326,Patch Set 7: Code-Review-1(5 comments)Hi Olav. There's one problem with the current code relating to the question who is allowed to depend on Lucene. Comments inline. It would be great if you could address them soon as I am on vacation from Saturday on (for a week).,7,8963,2014/8/28 15:08,2014/7/17 7:38,2014/8/28 14:48,1015,MERGED,11,487,2,5,8,positive,3,-2
1328,Patch Set 1: Code-Review-1Normally we read top-down. Git also used top-down in the rebase editor. We're used to that. We're not used to tortoise.The reason the history is shown in reverse is that you are usually interested in the newest changes.,1,8972,2014/8/17 19:42,2014/8/17 10:17,2014/8/17 14:30,4,MERGED,1,2,5,6,5,positive,2,-1
1332,Patch Set 5: Code-Review+2Using the three-arg constructor of ControlDecoration fixed the UI problem as well. Now all is well with this change. :-),5,8977,2014/8/28 19:48,2014/8/28 10:56,2014/8/28 19:47,8,MERGED,9,122,2,6,5,positive,2,-1
1333,Patch Set 1: Code-Review+2Looks pretty good !!All test plugins are included.Will be nice to see the new stats !Thanks !,1,8979,2014/8/28 19:30,2014/8/28 18:11,2014/8/28 18:14,0,MERGED,21,42,3,4,2,positive,5,-1
1334,"Patch Set 4:Note that I moved unrelated dependency upgrades from this patchset, as I'm planning to do those across the board for the next milestone (as it saves time when handling the CQ process). I also fixed the generation of the help mojo and updated the MavenProject field to use @Parameter as recommended in http://jira.codehaus.org/browse/MPLUGIN-257",4,8981,2014/8/28 18:08,2014/2/4 14:12,2014/8/28 18:03,4923,MERGED,4,111,2,3,5,positive,2,-1
1336,Patch Set 3: Code-Review+1(11 comments)looks good with some minor clarifications/cosmetic improvements,3,8998,2014/8/19 12:29,2014/6/2 10:55,2014/8/12 13:01,1706,MERGED,20,745,3,4,4,positive,2,-1
1338,Patch Set 1: Code-Review-1(1 comment)One small change to copyright and this will be good to go.,1,9009,2014/8/18 9:33,2014/8/14 13:51,2014/8/14 13:51,0,MERGED,1,5,3,4,3,positive,2,-1
1339,"Patch Set 2:I'd suggest to add an input dialog to select the servlet path in order to avoid the HTTP 500 error - 500 feels worse than a 404. Apart from this, I'm fine with the change.",2,9015,2014/8/14 15:28,2014/8/13 11:39,2014/8/14 14:28,26,MERGED,23,858,3,4,4,positive,3,-1
1341,"Patch Set 11:Jo├úo, your new png file is a screenshot of a ecore model opened in the Ecore tree editor !It is not a screenshot of a class diagram and does not illustrate your pattern ! You could open create a diagram with ecore tools 2 create some elements and take a screenshot (see the ecore tools 2 tuto/website)",11,9024,2014/8/13 14:32,2014/8/4 8:38,2014/8/13 12:13,219,MERGED,12,899,3,6,20,positive,2,-1
1342,"Patch Set 2:I will leave the image for when the wizard will be fine, about the action I don't know exactly how to start the wizard in action returning a command to action, if I put the code of open wizard in the action when I right click in viewpoint it open the wizard without choose any option.",2,9024,2014/8/5 9:37,2014/8/4 8:38,2014/8/4 8:56,0,MERGED,7,409,3,9,20,positive,3,-1
1347,"Patch Set 3:That seems fine to me. If you open two editors on the same comment you shouldn't expect both to be saved. I don't think that is a valid use case or something people would be likely to do so to me it's not a reason to make the dialog modal, and it certainly doesn't justify having a confirmation dialog on non-Windows systems.",3,9031,2014/8/18 17:21,2014/8/15 0:45,2014/8/15 19:46,19,MERGED,3,36,3,7,5,positive,3,-1
1351,"Patch Set 1: Code-Review+1Ok, I think I have general idea whats happened :) Looks good. Thanks!",1,9043,2014/8/18 18:14,2014/8/18 15:43,2014/8/18 15:43,0,MERGED,1,7,3,8,1,positive,3,-1
1353,"Patch Set 1:I am basically fixing comments on the header patch that was merged. Even if later we convert to ints, it is probably good to keep the information as ""raw"" as possible as long as possible. (No pun intended""",1,9049,2014/8/14 0:56,2014/8/13 19:52,2014/8/13 19:59,0,MERGED,4,20,3,9,4,positive,2,-1
1354,Patch Set 4: Code-Review+1 Verified+1It's probably a good idea to keep the API internal for now. Later on we should implement a way to plug-in new protocols using an extension point. When doing that we can think about what is needed as API.,4,9050,2014/8/18 17:18,2014/8/15 18:49,2014/8/18 15:34,68,MERGED,128,942,4,7,5,positive,2,-1
1356,"Patch Set 2: -Code-Review(6 comments)Thanks Stefen, Please also update the copyright header",2,9055,2014/8/4 6:21,2014/3/31 20:35,2014/8/3 11:28,2990,MERGED,5,160,3,4,9,positive,2,-1
1362,"Patch Set 4: Verified+1 Code-Review+2Thanks, Zhenni! Works great. Really appreciate your help.",4,9065,2014/8/18 14:47,2014/8/12 14:13,2014/8/18 8:35,138,MERGED,21,2259,2,4,4,positive,3,-1
1363,"Patch Set 3:(1 comment)except the version numbering and mentioned minor issues, the patch looks good to me and works fine",3,9070,2014/8/18 13:35,2014/8/14 16:14,2014/8/18 8:17,88,MERGED,8,224,3,8,5,positive,3,-1
1369,Patch Set 3:Ah :-DI wanted to do it before working on the completion proposals tests. :-),3,9088,2014/8/18 10:32,2014/8/18 8:57,2014/8/18 9:33,0,MERGED,84,200,3,9,3,positive,2,-1
1372,"Patch Set 4: Code-Review-1(3 comments)Just the tolerance thing (you're quite intolerant! xD), after that should be good to merge imo.",4,9105,2014/8/5 22:44,2014/8/4 20:53,2014/8/5 20:52,23,MERGED,4,362,3,4,8,positive,3,-1
1373,"Patch Set 7: Code-Review+2My bad, I guess it got lost in the sea of other errors I was having from other opened plugins... Gotta love these strict settings!",7,9105,2014/8/7 16:13,2014/8/4 20:53,2014/8/7 14:26,65,MERGED,4,370,4,6,8,positive,4,-3
1374,"Patch Set 3:I don't think it is much slower (although this should be benchmarked) since the same computation will have to be performed for both cases. The reason for not holding the events is that we are supposed to be able to read traces that are bigger than memory. Thus, I think this solution is better :)",3,9105,2014/8/5 20:10,2014/8/4 20:53,2014/8/5 18:55,22,MERGED,3,361,3,5,8,positive,2,-1
1375,"Patch Set 3: Code-Review-1(4 comments)I'm fine with this change, but have some minor comments (see code).It seems to me that MeasurementOperator does not need to be a SessionSingleton anymore, as singletons only make sense with lazy loading. Since the instance is explicitly created in MeasurementUtil, it could be registered directly with the UISession. However, if this is not a simple change, it could also be changed later.",3,9118,2014/8/7 13:32,2014/7/30 13:10,2014/8/1 12:18,47,MERGED,16,952,3,4,6,positive,3,-1
1378,"Patch Set 1:There are three groups of changes in this change-set:(a) update the Properties View implementation to reuse the same SWT controls    for its tabs when the selection changes to another single or multiple    selection presenting the same Views (according to the property-sheet model).    This is a ""compatible"" selection	(b) update the DataSource and ModelElement APIs that provide the source of    data bindings in the Properties View to allow a compatible selection to be    injected into the SWT controls already showing	(c) implementation of delegating observables that support the ModelElements'    dynamic updating of their data-binding sources	Part (a) is largely just a matter of updating the DefaultDisplayEngine to detect that the set of Views it asked to provide tab-descriptors for is the same as the set of Views for which it last provided tabs.  In this case, the existing tabs and all of their controls are re-used and the new selection is pushed into the DataSource that is currently feeding these controls.  Hopefully, the infrastructural changes in parts (b) and (c) that make this possible will allow us to further refine the re-use of controls such that any View will only be created once and can be swapped in and out of tabs using PageBooks.Part (b) updates the DataSource to support replacement of its selection.  On injection of a new selection, a notification is broadcast to announce the change and ModelElements listening to the DataSource update themselves to pick up the new selection.  This entails to fundamental changes in the way that ModelElements work:  (i) the ModelElementFactory now tells a newly created ModelElement which      factory created it, so that the ModelElement can delegate to that factory the      update for a new selection.  This is necessary because it is the factory that      knew how to unpack from the selection what the ModelElement needs when      creating the  element, so it is the best able to update the element later.  All      of the various ModelElementFactory implementations add this new capability      to update an existing element with a new selection	    (ii) when a ModelElement creates an IObservable for one of its properties, it      now wraps that observable in a new delegator pattern.  The delegator is      what ends up ultimately being bound to SWT controls.  To ensure that we      don't have to rebuild those bindings every time the selection changes      (which would entail considerable API churn to make accessible after the      fact), these observable delegators allow their delegates to be replaced at      any time (assuming that the replacement is the same kind of observable,      based on the ""compatible selection"").  Replacing the delegate fires the      usual observable change event, which updates the UI accordingly via the      bindings.	  Part (c) is the implementation of the delegating observables.  They ensure that the entire contract of the underlying observable is provided (including all custom interfaces such as ICommitListener) via the dynamic proxy class mechanism.  The usual contract of observables is implemented, including tracking the invocation of getter methods, all verified with a fairly comprehensive suite of JUnits tests.",1,9145,2014/5/26 20:04,2014/5/23 2:44,2014/5/26 19:58,89,MERGED,70,3980,2,4,6,positive,2,-1
1379,"Patch Set 3:Thanks, Camille.I had a brief look at one point at reuse on a section-by-section basis, but that is complicated by the need to maintain a consistent ordering of widgets in the layout.  When a section is removed, disposing its controls is easy enough, but adding widgets is more complicated.  Perhaps I'll be inspired to take another crack at it and will find some trick that makes it work.",3,9145,2014/7/3 13:33,2014/5/23 2:44,2014/6/10 17:41,446,MERGED,74,4208,3,6,6,positive,3,-2
1388,"Patch Set 1:1. Separator visibility - Its Label(SWT.SEPARATOR). I think its not that visiblebecause we use custom background for this control, insteadof platform one (not sure why?). I can make 2 separators - it will make it thicker...2. Sort top in alpha order -  I don't think so. People really won't notice order when it is 3 elements. But nice thing about not keeping it in alpha order that currently selected element is always first, and previous is always second, which is nice if you switching between two. Otherwise it would be more confusing3. LC run not from toolbar - I don't think we need to keep them (and it would be hard to do also, model does have backward mapping)4. Persistence - its a good idea (maybe not in this patch though)",1,9187,2014/8/5 13:12,2014/8/1 19:43,2014/8/1 20:08,0,MERGED,3,56,3,11,4,positive,2,-1
